{
  "version": 1,
  "opportunity_id": "223e4567-e89b-42d3-a456-426614174000",
  "title": "Add a low-cost closure constraint before heavier numerics",
  "summary": "Reframe the current target observable as a consistency-bootstrap problem with typed assumptions and one additional closure constraint. Goal: improve or falsify the baseline direction before introducing a heavier backend.",
  "scope": "IN_SCOPE",
  "bootstrap_mechanism_tags": ["symmetry", "closure", "constraint-propagation"],
  "related_island_ids": ["island-consistency-core"],
  "expected_artifacts": [
    {
      "kind": "derivation_md",
      "description": "Step-by-step derivation of the added constraint and its assumptions (NOT_FOR_CITATION).",
      "path_hint": "reports/draft.md"
    },
    {
      "kind": "numerics_output",
      "description": "Baseline vs constrained outputs with reproducible logs and hashes.",
      "path_hint": "runs/..."
    }
  ],
  "verification_plan": "Reproduce the baseline under identical assumptions, then rerun after enabling the new closure constraint and persist both outputs with comparable metrics.",
  "risks": [
    "The added constraint may be redundant; mitigate by proving what new information it contributes before large compute.",
    "Assumption bookkeeping may be incomplete; mitigate with typed assumptions and explicit reviewer signoff."
  ],
  "evidence_uris": [
    "https://example.org/theory/baseline-observable",
    "https://example.org/theory/closure-constraint"
  ],
  "tags": ["method:consistency-bootstrap", "topic:target-observable", "domain:theory", "opportunity_id:223e4567-e89b-42d3-a456-426614174000"],
  "created_at_utc": "2026-02-16T00:00:00Z"
}
